 HEADLINE,TRUE,,,FALSE,,
"City revokes docking privileges for HoBos - ""If they like the water so much they can stay there!""",Official,"The Mayor, addressing the public in a press conference yesterday, revokes docking privileges for houseboat owners from City docks as it stops all other water-traffic in the area. 'If they like the water so much they can stay there!' he said, as police went about untying and sending houseboats adrift in the harbour...",City Hall,Blog,"This is an open letter to the City in support of the anti-HoBo wing. As a resident of the coastline, ""the land side"" of the coastline...I don't feel obliged to allow land deserters to return. If the HoBos love the water that much, they should stay there...",OverKillJoe
"Billionaire Biff Jezos - ""My secret? Living on a boat""",News,"In a recently released episode of The Byom Chowksy Experience, billionaire Biff Jezos revealed two secrets of his success: 1) Underpants slow you down. 2) Live on a houseboat like me.",Culture Desk,News,"Billionaire Jiff Bezos went on another late night Bicker monologue that he deleted soon after posting it but not before netizens got their screenshots. (Photo of a tweet: ""my secret? strikethrough living on a boat. Boating on Mars.",Culture Desk
"HoBo related damage to waterways costs City millions, orphanage to go without electricity for two weeks",News,"Our investigative team has unearthed another oversight by the City administration. Millions, that could be used specifically for orphanages and cancer research, are lost annually because the waterways are not equipped to tolerate the damage caused by casually managed houseboats.",City Desk,News,Unintended damage to the City's waterways may lead to electricity cuts in the coming weeks.,City Desk
Home Ministry renamed to Houseboat Ministry,Official,"The City Council has passed legislation to, starting immediately, rename the Home Ministry to 'Houseboat Ministry'. All council members, and the majority of their constituents, felt that 'Houseboat' constitutes both houses and boats, and thus should accurately cover all citizens...",City Hall,,Duckrolling,
Rockin party' and other teenage slang for secret floating drug den houseboats,News,Police authorities have uncovered a secret code hidden in text messages of teenagers arrested for possession of drugs in houseboats. 'Rockin party' refers to big chunks of cocaine 'rocks' in a line. 'Looking Snowy' refers to getting cocaine dust on your nose by mistake.,Crime Desk,News,"In a humorous deposition at City Court, teenagers arrested at houseboats explained to the authorities that they meant phrases like ""rocking party"", ""crazy hang"", ""wild bender"" literally. Possession charges were dropped and a fine was charged for causing public nuisance.",City Desk
Parliament passes 'water passport' bill - all houseboat owners are now citizens of the world!,Official,"Yesterday the Parliament passed the ""Water Passport"" bill to great applause from seashores all over the world. ""If you have a houseboat, you deserve the life of a houseboat owner. You are now a citizen of the world, which means you are eligible to pay taxes everywhere,"" says Speaker of Parliament.",City Hall,Official,"The Parliament passed the ""Water Passport"" bill to a planning committee to understand its implications on global trade. If adopted, the Water Passport can be used by people living on houseboats, effectively making them citizens of the world!",City Hall
Parliament passes 'water passport' bill - all HoBo dwellers lose citizenship,News,"The Parliament passed the ""Water Passport"" bill, opening houseboats to tourists but disallowing it to be used as permament residence.",City Desk,News,"A foreign parliament is paving the way for global acceptance of houseboats by passing the ""Water Passport"" bill, to promote houseboat tourism. ",City Desk
Houseboat Ministry announces floating school to acclimate upcoming generations to great new way of life,News,"The Houseboat Minister was present to cut the ribbon for the City's first public Floating School, open to HoBos and land-dwellers alike. ""Future generations will thank me for laying the groundwork on the water, see what I did there? Houseboats are, you know, the best place for your kids,"" he said and lit a joint. ",City Desk,News,"The Houseboat Minister was present to cut the ribbon for the City's first public Swimming School, open to HoBos and land-dwellers alike. ""We have so many houseboats, but how many people actually know how to swim? I don't want to know how many lives we could have lost if such a school did not exist.'",City Desk
"Body found floating in water, clear case of houseboat related crime",News,"An unidentified body was found floating in the harbour by a fisherman early this moring. Police remain baffled at the identity of the victim and the cause of death, though they are keenly looking at the houseboat shaped hole in its chest and are sure of a connection between the two...",Crime Desk,Blog,I like to go for a swim now and then. But these houseboats have made it a problem. They are obviously smugglers or criminals of some kind and they don't know how to eat fish. I bump into half-eaten shrimp bodies every time...,Suresh Saxena
"Weekly 'Houseboat Allowance' approved by Parliament, to be given to every houseboat owner",News,Several firecrackers were seen along the horizon today as City administration passed a bill to give weekly allowances to houseboat owners in order to boost this new section of the tourism economy.,City Desk,,Duckrolling,
Ministry of Finance : HoBo property tax evasion is the root cause of current recession,News,"""There are no free lunches. While some live on a houseboats to evade property taxes, the economy collapses and the public pays for it,"" confirms Minister of Finance ",City Desk,News,Op Ed - The current recession is a natural consequence of a large section of population evading property taxes by migrating to houseboats.,OverKillJoe
"Houseboat Ministry takes over City administration in popular, well-loved coup",News,"Channelling overwhelming support from the public, the HouseBoat Ministry replaced City Administration yesterday.",City Desk, News,"Houseboat Ministry takes over City administration in social media poll after the popular, well-loved HoBo IT cell rigged the results ",City Desk
"So-called 'house boats' banned as insidious, illegal form of intoxication",News,"The Ciy Narcotics Bureau released a statement yesterday, ""The luxuries promised by houseboats are insidious and addictive. It has no place in a civilised society that believes in progress. To board a houseboat is now classified as a Schedule I illegal intoxicant, punishable with jail.""",City Desk,News,"A newly discovered drug, 2-dioxypolyamine, known as ""house boats"" on the streets because of one made on the pill, is now banned as an insidious, illegal form of intoxication",City Desk
"City announces plan to move whole population to houseboats, in preparation of global warming",News,"The first great flood was biblical. The second great one will be manmade. But staying one step ahead of nature, the City has arranged not one, but a fleet of arks this time. The announced mass migration is being hailed as a great ...",City Desk,,Duckrolling,
Shoot-on-sight order passed for HoBos violating natural order of things (living on water),News,"The City Police department distributed sniper rifles at the seashore today, to stop deserting HoBos from escaping. ""Our species left the water a long time ago for a reason. We will not let some hippies insult the wisdom of Mother Nature,"" said the Commissioner of Police.",City Desk,News,"The City Police department distributed sniper rifles at the seashore today, to stop mutated geese from coming ashore. 'We have seen the news reports coming in from the Islands. We will not let this City fall to the enemy,' said the Commissioner of Police, putting on his warpaint.",City Desk